UniqueID,SE_TOT_PRFL BOTHSEX       SKILL_MATH LOWSEC                ,SE_TOT_PRFL BOTHSEX       SKILL_MATH PRIMAR                ,SE_TOT_PRFL BOTHSEX       SKILL_READ LOWSEC                ,SE_TOT_PRFL FEMALE       SKILL_MATH LOWSEC                ,SE_TOT_PRFL FEMALE       SKILL_MATH PRIMAR                ,SE_TOT_PRFL FEMALE       SKILL_READ LOWSEC                ,SE_TOT_PRFL MALE       SKILL_MATH LOWSEC                ,SE_TOT_PRFL MALE       SKILL_MATH PRIMAR                ,SE_TOT_PRFL MALE       SKILL_READ LOWSEC                
SE_TOT_PRFL BOTHSEX       SKILL_MATH LOWSEC                ,1.0,,-0.058283921659541015,0.9714211677939777,,-0.10787941498050364,0.901825979270153,,-0.010501483395170666
SE_TOT_PRFL BOTHSEX       SKILL_MATH PRIMAR                ,,,,,,,,,
SE_TOT_PRFL BOTHSEX       SKILL_READ LOWSEC                ,-0.058283921659541015,,1.0,-0.29357714264950774,,0.9987615900210999,0.3788029101781656,,0.9988570665958266
SE_TOT_PRFL FEMALE       SKILL_MATH LOWSEC                ,0.9714211677939777,,-0.29357714264950774,1.0,,-0.3407735092880203,0.7734886868071127,,-0.2475506868787632
SE_TOT_PRFL FEMALE       SKILL_MATH PRIMAR                ,,,,,,,,,
SE_TOT_PRFL FEMALE       SKILL_READ LOWSEC                ,-0.10787941498050364,,0.9987615900210999,-0.3407735092880203,,1.0,0.332289216342911,,0.9952420599823234
SE_TOT_PRFL MALE       SKILL_MATH LOWSEC                ,0.901825979270153,,0.3788029101781656,0.7734886868071127,,0.332289216342911,1.0,,0.4226050760466609
SE_TOT_PRFL MALE       SKILL_MATH PRIMAR                ,,,,,,,,,
SE_TOT_PRFL MALE       SKILL_READ LOWSEC                ,-0.010501483395170666,,0.9988570665958266,-0.2475506868787632,,0.9952420599823234,0.4226050760466609,,1.0
